snt_id	term	definition	explanation	exp_id
G07.2_2749521565_3	prima facie case	It is a set of initial evidence or facts presented by one party in a legal proceeding, which, if accepted as true, is deemed adequate to support the legal elements of a claim or cause of action without further evidence or argument.	A prima facie case is like the first impression in a legal dispute. It's the evidence or facts presented by one side that, if taken at face value, seem to support their argument or claim. It's the initial showing that, if unchallenged, could be enough to win the case. However, it's not the final word — the other party can present their own evidence to counter it.	5
G07.2_2899514909_3	scalable method	It is a method that serves the purpose to fulfil a wide range of needs in the future.	As regards computer science, the term scalability is used to refer to the capability of being able to adpat in order to meet greater or more reduced needs. In this field, the adjective scalable is commonly put together with software applications, computers, networks and so on, meaning that they are able to adjust to circumnstances according to a purpose.	14
G07.2_2899514909_9	alternative media	They are nontraditional media forms that differ from the mainstream media forms in content, spread or the means used.	Exmples of alternative media are graffiti, pamphlets and community newsletters among others. They are especially used by minority groups for campaigning on particular issues.	14
G08.1_2806518684_1	blockchain technology	Blockchain technology is a distributed database for safe transactions in which data is stored in blocks linked together via cryptography.	Blockchain technology, at its core, involves creating a decentralized and distributed ledger that records transactions in a secure and transparent manner. The tamper-resistant and immutable nature of the chain of blocks ensures that once data is added to the blockchain, it becomes very difficult to alter or tamper with.	10
G08.1_2806518684_1	cryptocurrency	Cryptocurrency is a digital currency that uses cryptography for security and operates on a decentralized network of computers.	Unlike traditional currencies issued by governments and central banks, cryptocurrencies exist only in electronic form and rely on a decentralized and distributed ledger to record transactions.	10
G08.1_2806518684_5	theory of planned behavior	Theory of planned behavior is a psychological theory that links beliefs to behavior.	The theory maintains that three core components (attitude, subjective norms and perceived behavioral control) shape an individual's behavioral intentions. It aims to predict and understand human behavior, particularly in the context of decision-making related to goal-directed actions.	10
G08.1_2806518684_5	TPB	Theory of planned behavior is a psychological theory that links beliefs to behavior.	The theory maintains that three core components (attitude, subjective norms and perceived behavioral control) shape an individual's behavioral intentions. It aims to predict and understand human behavior, particularly in the context of decision-making related to goal-directed actions.	10
G08.1_2806518684_6	e-government	E-government is the usage of information and communication technologies to enhance and streamline the delivery of government services.	It refers to to the use of innovative technologies in the administrative processes to provide services to citizens, such as digital channel communication, data management and automation.	10
G08.1_2889349357_1	JavaScript	A scripting or programming language that allows to implement complex features on web page.	This term specifically designates a  programming language which is useful for developers and which is mostly used by them.	1
G08.1_2889349357_1	mining code	The software code that is used to mine new coins.	This complex term is to be found in those IT branches which are concerned with bitcoins and cryptocurrency.	1
G08.1_2889349357_1	mining rigs	Specialized computers customized for cryptocurrency mining.	The concept designated by this term is not recognizable by a non-expert reader.	1
G08.1_2889349357_2	cryptojacking	A cybercrime that involves the unauthorized use of people's devices by cybercriminals to mine for cryptocurrency.	This term is highly specific for a certain domain, i.e. cryptocurrencies.	1
G08.1_2889349357_2	drive-by mining	A method in which a piece of JavaScript code is embedded into a Web page to perform cryptocurrency mining on user machines that visit this page.	This complex term will not be easily understood by non-experts of this domain. A complete definition has to be looked up in the Web.	1
G08.1_2889349357_5	blacklist-based countermeasures	Measures which involve the identification and restriction of certain addresses, transactions, or entities deemed undesirable or associated with malicious activities.	Another complex term which designates a highly-restricted area of cryptocurrency technology.	1
G08.1_2889740224_2	bytecode	bytecode is a type of intermediate code that is generated by compilers and used by virtual machines or interpreters	Bytecode is like a special language that's created when you write code in a high-level language. It's not in the language that computers understand directly, but it's in a format that can be easily translated by a program called a virtual machine or an interpreter into the language that computers do understand. This makes it easier to run programs on different types of computers without having to rewrite them for each one.	18
G08.1_2889740224_3	Turing-complete	Turing-complete is a computational system or programming language that can simulate any algorithm or computation that a Turing machine can perform	Turing-complete is a term used to describe a computational system or programming language that possesses the same computational capabilities as a Turing machine, a theoretical model of computation introduced by mathematician Alan Turing in the 1930s. A Turing machine is a simple hypothetical device that can perform any computation that can be algorithmically defined. Just like a regular computer can run any program you give it, a Turing-complete system or programming language can also handle any task you throw at it. It's a way of saying that something is really powerful and versatile in terms of what it can do computationally.	18
G08.1_2889740224_4	buggy compilers	buggy compilers are software programs that translate source code written in a high-level programming language into machine code or executable programs, but contain defects or errors that result in incorrect or unexpected behavior during the compilation process	Buggy compilers are software tools that have flaws or issues in their implementation, which lead to errors or unexpected outcomes when compiling source code. When developers write code in a high-level programming language, they use compilers to translate that code into machine code that computers can understand and execute. However, if the compiler itself has bugs, it can introduce errors or inconsistencies into the resulting machine code, causing programs to behave incorrectly or crash. Common problems associated with buggy compilers include syntax errors, semantic errors, optimization issues, and code generation errors.	18
G08.1_2889740224_4	toolchains	a toolchain is a set of software tools and utilities that are used together in a sequence to perform a specific task or accomplish a particular goal, typically related to software development or system maintenance	A toolchain is like a collection of tools you might use for a specific job, but in the context of software development or system maintenance. It's not just one tool, but a series of tools that work together in a specific order to help you achieve something. In software development, a toolchain could include things like writing code, testing it, and fixing any mistakes. It's just a way of organizing the tools you need to do a specific job.	18
G08.1_2889740224_7	Ethereum	Ethereum is an open-source blockchain platform that enables developers to build and deploy decentralized applications (dApps) and smart contracts. It features its native cryptocurrency called Ether (ETH) and utilizes a decentralized network of nodes to process and validate transactions	Ethereum is a digital platform that allows developers to create applications that run on the blockchain, which is a decentralized and distributed ledger technology. Unlike traditional applications that run on centralized servers controlled by companies or governments, applications on Ethereum run on a network of computers called nodes, which work together to process and validate transactions.	18
G08.1_2889740224_7	Vandal	Vandal is a static program analysis framework for Ethereum smart contract bytecode	Vandal, as a security analysis framework, is like a software tool that helps find and fix problems with computer systems to make them more secure.	18
G08.1_2889740224_8	analysis pipeline	an analysis pipeline is a systematic sequence of steps and operations designed to process, analyze, and interpret data in a structured and automated manner	An analysis pipeline is a series of steps you follow to turn raw data into useful information or insights. The pipeline starts with collecting raw data from different sources, such as databases, files, or sensors. This data could be anything from text documents to images to sensor readings.	18
G08.1_2889740224_8	Ethereum Virtual Machine	the Ethereum Virtual Machine (EVM) is a decentralized, Turing-complete virtual machine that executes smart contracts and decentralized applications (dApps) on the Ethereum blockchain	The Ethereum Virtual Machine (EVM) is a special computer that lives on the Ethereum network. It's responsible for running smart contracts and apps that are built on Ethereum. It makes sure that everything runs smoothly and securely, and it's what makes Ethereum work as a platform for all kinds of digital applications.	18
G08.1_2889740224_8	EVM	"EVM is the acronym of ""Ethereum Virtual Machine"", a decentralized, Turing-complete virtual machine that executes smart contracts and decentralized applications (dApps) on the Ethereum blockchain."	EVM is the acronym that stands for Ethereum Virtual Machine. The Ethereum Virtual Machine (EVM) is a special computer that lives on the Ethereum network. It's responsible for running smart contracts and apps that are built on Ethereum. It makes sure that everything runs smoothly and securely, and it's what makes Ethereum work as a platform for all kinds of digital applications.	18
G08.1_2889740224_9	souffle language	the Soufflé language is a declarative logic programming language designed for expressing and evaluating complex relational queries and analyses	The Soufflé language is a tool for asking questions and finding answers about relationships in data. It's used for complex data analysis tasks where you want to understand how different pieces of information are connected. It uses a simple, easy-to-read syntax and logic-based rules to analyze relationships among different pieces of information.	18
G08.1_2889740235_1	art tools	A software which typically makes use of A.I..	It seems that art tools is not very popular in IT literature, nevertheless its meaning can be grasped quite immediately.	1
G08.1_2895247503_1	bitcoin	a decentralized cryptocurrency	a virtual currency, designed to act as money and as a form of payment for goods and services outside of the control of any one person, group, or entity, thus removing the need for third-party involvement in financial transactions and that can be exchanged electronically with vendiors that accept this kind of payment	2
G08.1_2898599358_1	denial-of-service attacks	involve malicious attempts to disrupt or suspend the normal functioning of a network.	It involve deliberate and malicious efforts to disrupt the normal functioning of a network, service, or system, rendering it temporarily or permanently inaccessible to its intended users.	15
G08.1_2898599358_1	flooding	network communication method.	It's a network communication method where data is sent to all nodes or routers in a network without consideration for the specific destination.It can be employed for various purposes, including data dissemination or network testing.	15
G08.1_2898599358_1	nodes	individual devices or points of connection within a network.	In various contexts, nodes can represent computers, servers, or any device participating in communication.	15
G08.1_2898599358_1	P2P networks	decentralized systems where individual devices share resources and directly communicate with each other without a central server.	In a P2P network, each device can function both as a client and a server, allowing for the distribution of tasks and resources among the network participants. This architecture promotes efficient sharing of files, data, or services directly between peers, enhancing scalability, flexibility, and resilience in network operations. P2P networks are commonly used for file sharing, distributed computing, and communication applications.	15
G08.1_2898599358_1	spam	unsolicited and often irrelevant or inappropriate messages sent over the internet.	Typically via email, instant messaging, or online forums. It is a common issue in online communication and can include advertisements or malicious content.	15
G08.1_2898599358_2	cryptocurrency space	digital environment or ecosystem encompassing various cryptocurrencies and blockchain technologies.	It encompasses the entire digital landscape related to cryptocurrencies. It includes various aspects such as the development, trading, and use of digital currencies like Bitcoin and Ethereum. This space is characterized by decentralized technologies, blockchain applications, and the broader ecosystem of cryptocurrency-related activities. Participants engage in activities like trading, investing, and developing new blockchain-based projects within this dynamic and evolving domain.	15
G08.1_2898599358_3	crypto assets	digital or virtual assets that leverage cryptographic techniques for secure financial transactions.	They include cryptocurrencies like Bitcoin and Ethereum, as well as tokens issued on blockchain platforms, representing various digital or physical assets.	15
G08.1_3004077497_1	mobile payment	the use of a mobile device, usually a smartphone, to make financial transactions electronically.	This can include making purchases in physical stores, online shopping, and transferring money. Mobile payment methods use digital technologies to securely process transactions, providing a convenient and often contactless alternative to traditional payment methods like cash or credit cards.	15
G08.1_3004077497_1	smart phone	portable, handheld device with advanced computing capabilities.	It typically features a touchscreen interface for user interaction, internet connectivity for browsing and communication, and a wide range of applications that can include productivity tools, games, and more.	15
G08.1_3004077497_1	smart watch	wrist-worn device with computational abilities, often synchronized with a smartphone, providing features.	It offers various functionalities beyond traditional timekeeping, such as fitness tracking, notifications for messages and calls, and the ability to run apps. Smartwatches provide users with quick access to information and services directly from their wrists.	15
G08.1_3004077497_2	blockchain-based cryptocurrency	digital currency that operates on a blockchain ensuring transparent transactions.	It ensures transparency and security in transactions by recording them in a decentralized and tamper-resistant manner. Examples include Bitcoin, known for peer-to-peer transactions, and Ethereum, which supports smart contracts and decentralized applications.	15
G08.1_3004077497_2	total value	the overall worth or sum of a set of assets, investments, or goods, often measured in financial terms.	In financial contexts, it is the aggregated value of all assets considered, providing a comprehensive measure of the combined financial worth.	15
G08.1_3004077497_2	USD	stands for United States Dollar, the official currency of the United States and widely used as a global reserve currency.	As a global reserve currency, the USD is commonly used in international trade and finance. It is denoted by the symbol $ and is subdivided into cents.	15
G08.1_3004077497_3	cryptocurrency payment	the use of digital or virtual currencies to conduct financial transactions.	These transactions are decentralized, secure, and often provide a level of privacy. Users can make payments for goods or services, transferring value directly between parties without the need for traditional banking intermediaries. Popular cryptocurrencies like Bitcoin and Ethereum are commonly used for cryptocurrency payments.	15
G08.1_3004077497_4	financial service	service related to managing, investing, or facilitating the flow of money and financial transactions provided financial institutions.	These services involve the management, handling, or investment of money to help individuals, businesses, or governments achieve their financial goals. Financial services are provided by various institutions, including banks, credit unions, investment firms, and insurance companies.	15
G08.1_3004077497_5	payment processing latency	the time delay or lag between initiating a payment transaction and its completion.	It measures the speed or responsiveness of the payment system, indicating how quickly the system can complete the necessary steps to ensure a successful transaction. Lower latency implies faster and more efficient payment processing.	15
G08.1_3004077497_6	centralized bank	financial institution that operates as a central authority in a country's banking system.	It is typically responsible for managing monetary policy, regulating and supervising other banks, issuing and controlling the national currency, and ensuring the stability and soundness of the overall financial system. The central bank plays a crucial role in influencing economic conditions, controlling inflation, and maintaining the stability of the nation's currency.	15
G08.1_3004077497_7	AML	a set of laws, regulations, and procedures designed to detect and prevent the illegal practice of money laundering.	They require financial institutions and other regulated entities to implement controls, conduct due diligence on customers, monitor transactions, and report suspicious activities to relevant authorities. The goal is to combat financial crimes and maintain the integrity of the financial system.	15
G08.1_3004077497_7	anti-money laundering	a set of laws, regulations, and procedures designed to detect and prevent the illegal practice of money laundering.	They require financial institutions and other regulated entities to implement controls, conduct due diligence on customers, monitor transactions, and report suspicious activities to relevant authorities. The goal is to combat financial crimes and maintain the integrity of the financial system.	15
G08.1_3004077497_7	know your customer	a regulatory process where businesses verify and authenticate the identity of their customers to establish a secure relationship.	This process involves obtaining information about customers' identity, address, and financial activities to prevent fraud, comply with regulations, and establish a secure and trustworthy relationship. KYC helps ensure that businesses are aware of who their customers are and that they are not involved in illicit activities.	15
G08.1_3004077497_7	KYC	a regulatory process where businesses verify and authenticate the identity of their customers to establish a secure relationship.	This process involves obtaining information about customers' identity, address, and financial activities to prevent fraud, comply with regulations, and establish a secure and trustworthy relationship. KYC helps ensure that businesses are aware of who their customers are and that they are not involved in illicit activities.	15
G09.1_2047319275_1	phisher	Cyber attacker who steals sensitive information through the fraudolent usie of computer-based means.	Type of cyber attack in which attackers use fraudolent techniques to trick users into providing sensitive information and personal details. Typically, phishing attacks involve fraudulent emails, messages, or websites that appear to be from a trustworthy source.	12
G09.1_2047319275_1	phisher	Cyber attacker who steals sensitive information through the fraudolent use of computer-based means.	Type of cyber attack in which attackers use fraudolent techniques to trick users into providing sensitive information and personal details. Typically, phishing attacks involve fraudulent emails, messages, or websites that appear to be from a trustworthy source.	13
G09.1_2047319275_1	phishing countermeseaures	Precaution strategies taken to protect individuals from phishing attacks.	Phishing countermeasures involve strategies to protect individuals and organizations from falling victims to phishing attacks. Key measures include email filtering and authentication, multi-factor authentication, using secure websites, software updates, URL inspection and enforcing security policies. These measures collectively reduce the risk of falling victim to deceptive online tactics.	12
G09.1_2047319275_1	phishing countermeseaures	Precaution strategies taken to protect individuals from phishing attacks.	Phishing countermeasures involve strategies to protect individuals and organizations from falling victims to phishing attacks. Key measures include email filtering and authentication, multi-factor authentication, using secure websites, software updates, URL inspection and enforcing security policies. These measures collectively reduce the risk of falling victim to deceptive online tactics.	13
G09.1_2047319275_3	phishing attacks	Cyber attack in which attackers use deceptive tactics to trick individuals into divulging sensitive information.	Cyber threat involving deceptive emails and messages  appearing to be from trustworthy sources, aiming to trick individuals into revealing sensitive information or clicking on malicious links.	12
G09.1_2047319275_3	phishing attacks	Cyber attack in which deceptive tactics are used to trick individuals into divulging sensitive information.	Cyber threat involving deceptive emails and messages  appearing to be from trustworthy sources, aiming to trick individuals into revealing sensitive information or clicking on malicious links.	13
G09.1_2047319275_3	phishing campaigns	Coordinated attacks by phishers.	Coordinated efforts by cyber attackers to deceive individuals and organizations and trick them into divulging sensitive information.	12
G09.1_2047319275_3	phishing campaigns	Coordinated attacks by phishers.	Coordinated efforts by cyber attackers to deceive individuals and organizations and trick them into divulging sensitive information.	13
G09.1_2047319275_3	phishing websites	Fraudulent and malicious website created by phishers.	Websites purposely designed to closely resemble legitimate websites of reputable organizations in order to trick users into providing sensitive information.	12
G09.1_2047319275_3	phishing websites	Fraudulent website created by phishers.	Websites purposely designed to closely resemble legitimate websites of reputable organizations in order to trick users into providing sensitive information.	13
G09.1_2047319275_4	content-based approach	Analysis strategy that relies on the characteristics of the object of study itself.	A content-based system is an approach relying on the intrinsic features of the content itself, using them as a basis for the analysis.	12
G09.1_2047319275_4	content-based approach	Analysis strategy that relies on the characteristics of the object of study itself.	A content-based system is an approach based on the intrinsic features of the content itself, using them as the starting point of the analysis.	13
G09.1_2047319275_4	detection rate	Metric used to measure the effectiveness of a system in detecting specific items.	Percentage that assesses the performance of a machine.	12
G09.1_2047319275_4	detection rate	Measure of the effectiveness of a system in detecting specific items.	Percentage that assesses the performance of a machine.	13
G09.1_2047319275_4	false positive rate	Rate at which a system detects a condition that's not present.	Metric used to assess the performance of a system, calculating how many times it incorrectly identifies instances as positive when they are actually negative.	12
G09.1_2047319275_4	false positive rate	Rate at which a system detects a condition that's not present.	Metric used to assess the performance of a system, calculating how many times it incorrectly identifies instances as positive when they are actually negative.	13
G09.1_2202800066_1	mobile devices	Piece of portable electronic equipment that can connect to the internet, especially a smartphone or tablet computer.	NA	21
G09.1_2202800066_2	desktop	A view on a computer screen that contains icons (small symbols or pictures) representing files, programs, and other features of the computer.	NA	21
G09.1_2202800066_2	laptop	A computer small and light enough to be carried around.	NA	21
G09.1_2202800066_3	applications	An official request for something, usually in writing or a computer program that is designed for a particular purpose.	NA	21
G09.1_2202800066_4	illegal activities	Unlawful activity that constitutes a crime under state or federal law.	NA	21
G09.1_2202800066_5	cyber crimes	Criminal activity that either targets or uses a computer, a computer network or a networked device.	Is a type of crime that involves the use of computers, such as stealing people's data.	21
G09.1_2202800066_5	hike	Sudden or large increase in prices, rates, taxes, or quantities.	NA	21
