snt_id	term	definition	explanation	exp_id
G01.1_1524829466_3	PDA	The personal digital assistant (PDA) is a small, mobile, handheld device that provides computing and information storage and retrieval capabilities for personal or business use.	The PDA is a multi-purpose mobile device that has audio capabilities, it can be used as a portable media player, and many of them can be used as telephones.	19
G01.1_1524829466_3	personal digital assistant	The personal digital assistant is a small, mobile, handheld device that provides computing and information storage and retrieval capabilities for personal or business use.	The PDA is a multi-purpose mobile device that has audio capabilities, it can be used as a portable media player, and many of them can be used as telephones.	19
G01.1_1527694686_1	mobile terminal	portable device that enables transactions to be submitted via a mobile telecommunications network	portable devices such as mobile PCs, cell phones and PDAs that enable communication or access to information	2
G01.1_1527694686_1	personal digital assistant	small, mobile, handheld device that provides computing and information storage and retrieval capabilities	the precursor to smartphones, it usually had a small physical keyboard even tough some had an electronically sensitive pad on which handwriting could be received	2
G01.1_1527694686_1	ubiquitous environment	environment where a huge numbers of sensors constantly gather information and send it to the fog	environment where technology is seamlessly integrated and pervasive, present everywhere and constantly accessible	2
G01.1_1527694686_10	u-PaV system	system that automatically transforms web content into TV-like video content for ubiquitous environments	acronym for universal passive viewer system, a system that transforms web content incorporating audio and visual components that are presented on a display	2
G01.1_1527694686_10	ubiquitous passive viewer system	system that automatically transforms web content into TV-like video content for ubiquitous environments	system that transforms web content incorporating audio and visual components that are presented on a display	2
G01.1_1527694686_10	universal passive viewer system	system that automatically transforms web content into TV-like video content for ubiquitous environments	system that transforms web content incorporating audio and visual components that are presented on a display	2
G01.1_1527694686_11	Macromedia Flash file	a file format used for authoring Macromedia applications	a file format, also known as Adobe Flash File, that can be used to store vector image data, audio, timelines to control animation playback, bitmapped video content, and include or reference ActionScript code	2
G01.1_1527694686_2	terminal type	device that allows users to interact with a computer system	the type of device that allows your computer and the host computer to which you are connected to exchange information	2
G01.1_1527694686_3	desktop terminal	a computer display that enables user to enter data or commands for a computer system and which displays the received output	a computer display, that serves as a user interface enabling individuals to input data or commands into a computer system, and subsequently presents the processed information or output received from the system, typically used in stationary settings	2
G01.1_1527694686_3	terminal	a device at which a user enters data or commands for a computer system and which displays the received output	a combination of a keyboard and output device, such as a video display unit, by which data can be entered into or output from a computer or electronic communications system	2
G01.1_1527694686_6	keyword analysis	examination and analysis of keywords present in the content of a web page	examination and analysis of the words on a web page, in order to understand its emotional tone and convey it to the users by changing the background color of the screen	2
G01.1_1527694686_7	logotype	text-based logos that usually spell out the brand’s name or an acronym	a word or group of separate letters designed in a particular fashion that refer to a trademark, company emblem, or similar device	2
G01.1_1527980854_1	LAN	A local area network (LAN) is a computer network that interconnects computers within a limited area.	A LAN is a collection of devices connected together in one physical location, such as a building, office, or home.	19
G01.1_1527980854_1	PDA	The personal digital assistant is a small, mobile, handheld device that provides computing and information storage and retrieval capabilities for personal or business use.	The PDA is a multi-purpose mobile device that has audio capabilities, it can be used as a portable media player, and many of them can be used as telephones.	19
G01.1_1527980854_1	Personal Digital Assistant	The personal digital assistant is a small, mobile, handheld device that provides computing and information storage and retrieval capabilities for personal or business use.	The PDA is a multi-purpose mobile device that has audio capabilities, it can be used as a portable media player, and many of them can be used as telephones.	19
G01.1_1527980854_1	two-way location aware system	The two-way location aware system is a system that can determine the location of an user and it allows to exchange positioning information with other users of the system.	The one-way location aware system offer information around the users' present position, the two-way system let users to exchange the positioning information to one another.	19
G01.1_1528342628_1	PDA	It is an acronym that stands for Personal Digital Assistant.	The acronym is usually written right next to the extended word (in this case personal digital assistant) so as to provide a complete information about the term. The acronym tends to appear more than the extended version, since it allows to read the text faster.	14
G01.1_1528342628_1	Personal Digital Assistant	It is a small, mobile, handheld, multipurpose and electronic device for personal or business use.	This organizer offers a variety of functions, such as keeping shcedules, writing an appointment in a virtual calendar or notes. The fact that its size is small allows the user to carry it wherever they go. It is usually pen-based, which means that it is necessary to have a stylus in order to write on the virtual keyboard.	14
G01.1_1528342628_2	network failure	It is a problem of a network element that is not able to perform a required function.	Network elements are those elements that represents a facility or equipment used in the provision of a telecommunication service. When there is a problem in one of the network elements, there may be a partial or total network failure that would lead to improper functioning.	14
G01.1_1529793248_2	decision support system	It is a computer program application that analyzes data in an organization or business to help in the decision-making process of an individual or a group of individuals.	It is a system that produces detailed information reports after having gathered and analyzed even huge amounts of previously unstructured data. It is differnet from any other ordinaary applications, since it doesn't just collect data but it analyzes them. In this way, it improves efficiency.	14
G01.1_1529793248_2	DSS	It is an acronym that stands for Decision Support System.	The acronym is usually wirtten right next to the extend word as to provide an overview of the term.	14
G01.1_1529793248_2	PDA	It is an acronym that stands for Personal Digital Assistant.	The acronym is usually written right next to the extended word (in this case personal digital assistant) so as to provide an overview of the term. The acronym tends to appear more than the extended version, since it allows to read the text faster.	14
G01.1_1529793248_2	personal digital asstant	It is a small, mobile, handheld, multipurpose and electronic device for personal or business use.	This organizer offers a variety of functions, such as keeping shcedules, writing an appointment in a virtual calendar or notes. The fact that its size is small allows the user to carry it wherever they go. It is usually pen-based, which means that it is necessary to have a stylus in order to write on the virtual keyboard.	14
G01.1_1530854586_1	mobile computing technology	Computing technology to manage, process, and communicate data without any network connection between devices.	Technology that enables the exchange of data and the execution of computational tasks through mobile devices that do not require any connection to the base or central network.	3
G01.1_1530854586_1	wireless computing technology	Computing technology to manage, process, and communicate data without any wire.	Technology that enables the exchange of data and the execution of computational tasks without the necessity of physical cables or wired connections.	3
G01.1_1532553277_1	8-bit microcontroller	A 8-bit microcontroller is a small computer on a single integrated circuit that is capable of processing 8-bits of data at a time.	A 8-bit microcontroller is a computing or graphics system that operates with a data width of 8 bits, it means that the system can process and represent information using 8 binary digits or bits.	19
G01.1_1532553277_1	long-range monitor	A long-range monitor is a device that is able to transmit audio and video signals even when there are significant distances between the locations.	It is a monitor device that can send audio and video information between two or more distant locations.	19
G01.1_1532553277_1	microcontroller	Compact integrated circuit device that contains a processor core, memory, and programmable input/output peripherals.	Microcomputers that are entirely self-contained on a single chip, designed to run a single basic programme repeatedly and used for controlling other portions of an electronic system, usually via a microprocessor unit (MPU), memory, and some peripherals.	3
G01.1_1532553277_1	voltage harmonic	Presence of frequencies that are multiples of the fundamental frequency of the system in the voltage waveform of an electrical system.	Undesirable periodic variations in the voltage waveform of an electrical system characterized by harmonics, which are electrical signals that occur at frequencies that are multiples of the fundamental frequency of a power supply, and that can potentially cause adverse effects in electrical equipment and systems.	3
G01.1_1532553277_1	voltage harmonic monitor device	"The term ""voltage harmonic monitor device"" refers to a piece of equipment used to measure and monitor the presence of voltage harmonics in an electrical system."	The term voltage harmonic monitor device refers to a tool that helps check the quality of electrical power in a system. It specifically looks for unwanted distortions called harmonics in the voltage.	19
G01.1_1532553277_2	Fast Fourier Transform	A fast Fourier transform (FFT) is an algorithm that calculates the discrete Fourier transform of some sequence. The discrete Fourier transform is a tool to convert specific types of sequences of functions into other types of representations.	A fast Fourier transform can be used in various type of signal processing. It may be useful in reading things like sound waves, or for any image-processing technologies. It can be used to solve various types of equation or show various types of frequency.	19
G01.1_1532553277_2	FFT	"Algorithmic technique  for the implementation of the ""Discrete Fourier Transformation"" (DFT)."	Optimized algorithm which facilitates signal analysis such as power spectrum analysis and filter simulation by means of digital computers.	3
G01.1_1532553277_2	FFT	A fast Fourier transform (FFT) is an algorithm that calculates the discrete Fourier transform of some sequence. The discrete Fourier transform is a tool to convert specific types of sequences of functions into other types of representations.	A fast Fourier transform can be used in various type of signal processing. It may be useful in reading things like sound waves, or for any image-processing technologies. It can be used to solve various types of equation or show various types of frequency.	19
G01.1_1532553277_2	harmonic	Frequencies that are multiples of the fundamental frequency of a system.	Electrical signals that occur at frequencies that are multiples of the fundamental frequency of a power supply, and that can potentially cause adverse effects in electrical equipment and systems.	3
G01.1_1532553277_2	harmonic analysis algorithm	An harmonic analysis algorithm is type of algorithm of the harmonic analysis, which is a branch of mathematics concerned with investigating the connections between a function and its representation in frequency.	NA	19
G01.1_1532553277_4	IC card	Portable and credit-card-sized device that incorporates an embedded microprocessor or integrated circuit.	Integrated circuit card with the purpose of storing, processing, and managing data, often used for identification, authentication, and secure data storage applications.	3
G01.1_1532553277_4	IC card	An IC card is a physical electronic authentication device, used to control access to a resource.	An IC card is a plastic credit card-sized card with an embedded integrated circuit (IC) chip.	19
G01.1_1532553277_4	PDA	Handheld electronic device provided with an electronic visual display and programs to store and manage personal information.	Small electronic device designed to provide functionalities for personal organization and information management, allowing users to take digital notes using touch screen, a stylus or a keyboard and synchronize data with a computer.	3
G01.1_1532553277_4	PDA	The personal digital assistant is a small, mobile, handheld device that provides computing and information storage and retrieval capabilities for personal or business use.	The PDA is a multi-purpose mobile device that has audio capabilities, it can be used as a portable media player, and many of them can be used as telephones.	19
G01.1_1532553277_4	Personal Digital Assistant	The personal digital assistant is a small, mobile, handheld device that provides computing and information storage and retrieval capabilities for personal or business use.	The PDA is a multi-purpose mobile device that has audio capabilities, it can be used as a portable media player, and many of them can be used as telephones.	19
G01.1_1532553277_4	serial port	A serial port is a serial communication interface on computer, through which information transfers in or out sequentially one bit at a time.	A serial port is used to physically connect asynchronous devices to a computer. They are located on the back of the system unit, either integrated or using a multiport adapter.	19
G01.1_1533716782_1	CPU	Principal part of any digital computer system, generally composed of the main memory, control unit, and arithmetic-logic unit.	CPU is a widely spread and accepted acronym which stands for Central Processing Unit. This term pertains to the IT domain and its diffusion is due to the relevance of the CPU in any computer system.	1
G01.1_1533716782_3	direct migration	A feature which enables the transfer of persistent volumes and internal images directly from the source cluster to the destination cluster without an intermediary replication repository.	direct migration is perceived as highly specific in IT contexts. Even if it is highly unlikely that any non-expert user may know of its existence, the term clearly defines the scope of this feature.	1
G01.1_1533716782_3	linear	An approach used in image processing which makes use of scaling, rotation and translation procedures in order to transform images.	linear is another term pertaining to IT that acquires a specific meaning in this domain.	1
G01.1_1533716782_3	overview	A type of web display that lists recently accessed activities and tasks.	overview hints at a well defined approach which is known by IT domain experts.	1
G01.1_1533716782_4	gateway	A new Overview method which is for use on the small screen and that exploits a user’s familiarity of a web page.	gateway keeps the lexical meaning of the original generic word gateway, but it transfers it to the IT domain where it serves to describe a domain-specific concept.	1
G01.1_1534162055_1	Mobile system	a mobile system is software that allows smartphones, tablets and other devices to run applications and programs	In software development, a mobile system refers to a comprehensive set of software components, applications, and services designed to operate on mobile devices such as smartphones, tablets, and wearables. This includes the development of mobile applications, their integration with backend services, and considerations for the unique features and constraints of mobile platforms. A mobile provides an interface between the device's hardware components and its software functions. It typically starts when a device powers on, presenting a screen with icons or tiles that show information and provide application access. Mobile systems also manage cellular and wireless network connectivity and phone access.	20
G01.1_1534162055_1	software development	software development refers to the process of creating, designing, programming, testing, and maintaining software applications or systems	Software development is the process of creating and building software applications or programs. It involves several steps. Firstly, there's the planning phase: this stage involves gathering requirements and defining what the software should do. Next comes the design phase, where developers architect the structure of the software. As development progresses, the implementation phase starts and it is where developers write the actual code for the software, following the design specifications. Once the code is written,  it's important to test the software to ensure it works as intended and is free of errors or bugs. After testing, the software is ready to be deployed or released for use by customers or end-users. This involves installing the software on servers or devices and making it accessible to users. Once the software is deployed, developers may need to provide ongoing support, fix any issues that arise, and release updates or new versions of the software to add features or improve performance.	18
G01.1_1534162055_1	Software development	software development refers to a set of computer science activities dedicated to the process of creating, designing, deploying and supporting software	"Software development is a process involving several steps to create, test and maintain software applications, ensuring that they meet user needs and objectives. It involves a series of well-defined steps to produce reliable, efficient, and functional software solutions. Software itself is the set of instructions or programs that tell a computer what to do. It is independent of hardware and makes computers programmable. There are three basic types: system software, to provide core functions such as operating systems, disk management, utilities, hardware management and other operational necessities; programming software, to give programmers tools such as text editors, compilers, linkers, debuggers and other tools to create code; application software (applications or apps), to help users perform tasks. Office productivity suites, data management software, media players and security programs are examples. Applications also refers to web and mobile applications like those used to shop on Amazon.com, socialize with Facebook or post pictures to Instagram. A possible fourth type is embedded software. Embedded systems software is used to control machines and devices not typically considered computers — telecommunications networks, cars, industrial robots and more. These devices, and their software, can be connected as part of the Internet of Things (IoT)."	20
G01.1_1534162055_2	Negotiation support system	Negotiation Support Systems (NSS) are a special class of Group Decision Support Systems which emphasize computerized assistance for situations in which there is strong disagreement on factual or value judgements among group members	A Negotiation Support System (NSS) is a computer-based tool or software designed to assist individuals or groups involved in negotiation processes. The purpose of an NSS is to provide support, guidance, and analytical tools to enhance the effectiveness of negotiations and help parties reach mutually satisfactory agreements. These systems leverage technology to facilitate various stages of negotiation, from preparation to execution. Different platforms stress different aspects of negotiation. Some manage the communication process, and stress keeping inter-party communication simple and structured by providing dedicated fields, formats, and forms. Others provide multiple communication venues for parties to utilize, according to their own comfort and choice, such as secure e-mail, instant messaging, or chat channels. Certain NSS focus on the decision-making process, and assist parties in analyzing their needs and preferences. If parties so choose, these platforms can also conduct an independent analysis of both parties’ needs and preferences and suggest solutions that the software considers optimal.	20
G01.1_1534162055_2	PDA	"""PDA"" is an acronym that  stand for personal digital assistant (PDA), which is a handheld electronic device or software application designed to provide organizational, productivity, and communication functionalities to individuals"	The acronym PDA stands for Personal Digital Assistant, which is a compact device or application that combines organizational tools like calendars and notes with communication features such as email and messaging. It's designed to help individuals manage their schedules, tasks, and contacts conveniently in one place, offering a portable solution for staying productive and connected on the go.	18
G01.1_1534162055_2	PDA	The personal digital assistant is a small, mobile, handheld device that provides computing and information storage and retrieval capabilities for personal or business use.	The PDA is a multi-purpose mobile device that has audio capabilities, it can be used as a portable media player, and many of them can be used as telephones.	19
G01.1_1534162055_2	PDA	a PDA is a handheld computer that serves as a tool for reading and conveying documents, electronic mail, and other electronic media over a communications link, as well as for organizing personal information, such as a name-and-address database, a to-do list, and an appointment calendar	A PDA is like a mini computer you can carry around to manage your daily life. It is a small electronic device that helps you stay organized. It's like a pocket-sized helper that can do things like keeping track of your schedule (calendar), storing your contacts, and helping you with tasks and notes. Some PDAs can also send emails and make phone calls. They usually have a touchscreen, and you can use a stylus or your fingers to interact with them. While PDAs were popular in the past, many of their features are now found in modern smartphones.	20
G01.1_1534162055_2	Personal Digital Assistant	The personal digital assistant is a small, mobile, handheld device that provides computing and information storage and retrieval capabilities for personal or business use.	The PDA is a multi-purpose mobile device that has audio capabilities, it can be used as a portable media player, and many of them can be used as telephones.	19
G01.1_1534162055_2	Personal Digital Assistant	a Personal Digital Assistant is a handheld computer that serves as a tool for reading and conveying documents, electronic mail, and other electronic media over a communications link, as well as for organizing personal information, such as a name-and-address database, a to-do list, and an appointment calendar	A Personal Digital Assistant is like a mini computer you can carry around to manage your daily life. It is a small electronic device that helps you stay organized. It's like a pocket-sized helper that can do things like keeping track of your schedule (calendar), storing your contacts, and helping you with tasks and notes. Some Personal Digital Assistants can also send emails and make phone calls. They usually have a touchscreen, and you can use a stylus or your fingers to interact with them. While Personal Digital Assistants were popular in the past, many of their features are now found in modern smartphones.	20
G01.1_1534162055_2	Taxonomy	taxonomy is the process of naming and classifying things such as animals and plants into groups within a larger system, according to their similarities and differences	Taxonomy refers to the science, practice, or system of classification. It involves organizing and categorizing items, concepts, or organisms based on shared characteristics or attributes. Taxonomies are used in various fields, including biology, information science, linguistics, technology, and knowledge organization. Taxonomies often have a hierarchical structure, where categories are organized in a tree-like or nested fashion. This hierarchy allows for a systematic and organized representation of relationships. Taxonomies aim for systematic organization, providing a structured framework for understanding and navigating a particular domain. This systematic arrangement facilitates easy retrieval and comprehension. Taxonomies often involve the assignment of names or labels to categories and subcategories. Consistent and meaningful nomenclature helps communicate the relationships and characteristics of the items being classified. In the digital realm, taxonomies play a crucial role in organizing and structuring information on websites, databases, and other digital platforms. They enhance searchability and navigation.	20
