snt_id	term	definition	explanation	exp_id
G01.1_1019677957_1	mobile emerging carrier	a growing mode of education which makes use of mobile devices	mode of education which combines learning with mobile devices such as personal digital assistants, smartphones, and e-books, and which is becoming gradually widespread	2
G01.1_1019677957_1	PDA	small, mobile, handheld device that provides computing and information storage and retrieval capabilities	acronym of personal digital assistant, the precursor to smartphones, which usually had a small physical keyboard even tough some had an electronically sensitive pad on which handwriting could be received	2
G01.1_1019677957_1	personal digital assistant	small, mobile, handheld device that provides computing and information storage and retrieval capabilities	the precursor to smartphones, it usually had a small physical keyboard even tough some had an electronically sensitive pad on which handwriting could be received	2
G01.1_1019677957_2	context-aware technology	systems or devices that have the capability to gather information about the environment or context in which they are operating and adapt their behavior accordingly	technologies that make use of data analytics, machine learning, and user interaction techniques to deliver personalized and relevant services to users based on their surroundings, preferences, activities, and real-time conditions	2
G01.1_1019677957_2	mobile carrier	a mode of education which makes use of mobile devices	mode of education which combines learning with mobile devices such as personal digital assistants, smartphones, and e-books	2
G01.1_1019677957_2	wireless network environment	a system in which devices makes use of Radio Frequency connections between nodes in the network	a system in which devices are connected to a network without the need for physical cables or wires	2
G01.1_1019677957_3	mobile learning	learning that involves accessing educational content via mobile devices	use of mobile devices such as smartphones, tablets, and other portable gadgets for the delivery of learning content and educational experiences	2
G01.1_1019677957_4	mobile learning activity	educational tasks, exercises, or experiences via mobile devices	educational tasks, exercises, or experiences that make use of mobile devices such as smartphones, tablets, and other portable gadgets for the delivery of learning content and educational experiences	2
G01.1_1019677957_6	competetive learning group of students	group where students are engaged in a learning environment where competition is integrated	group where students learn by working in opposition to one another using the intrinsic motivation to win and be better than the others	2
G01.1_1019677957_6	non-competetive learning group of students	group where students are engaged in a learning environment where competition is not integrated	group where students learn by working in a non-competitive environment, in which the focus might be on collaborative learning, cooperate activities or individual progress	2
G01.1_111823101_1	Bluetooth wireless technology	short-range wireless communication technology that allows devices to connect and exchange data.	It facilitates data exchange between devices like smartphones, computers, and peripherals such as headphones or medical devices. Bluetooth technology eliminates the need for physical cables, providing convenience and versatility in device connectivity.	15
G01.1_111823101_1	electrophysiological wireless	wireless transmission and recording of physiological electrical activity.	It refers to the wireless transmission and recording of electrophysiological signals, which involve the electrical activity generated by cells, tissues, or organs. In various applications, it often pertains to monitoring neural or muscular activity without the need for physical connections.	15
G01.1_111823101_1	GPS device	device for determining and providing accurate geographical location information.	Is a portable electronic tool equipped with Global Positioning System technology. It receives signals from satellites to determine its precise geographical location. GPS devices are commonly used for navigation, mapping, and tracking the movement of objects or individuals.	15
G01.1_111823101_1	local server	server that operates within a limited geographical area, providing data storage to local devices.	is a computing system that operates within a specific geographic area, providing services such as data storage, processing, or networking. It serves the needs of devices within its proximity and is often used for faster data access and reduced latency.	15
G01.1_111823101_1	mobile phone	portable electronic device used for communication.	It provides voice and text communication, internet access, and a variety of applications. Mobile phones have become integral to daily life, serving as multifunctional tools for both personal and professional activities.	15
G01.1_111823101_1	physiological signals	biological indicators or measurements that reflect the functioning of physiological systems in the body.	These signals include vital parameters like heart rate, blood pressure, respiratory rate, and brain activity. Monitoring physiological signals is crucial in healthcare, research, and fitness to assess and understand the body's health and performance.	15
G01.1_111823101_1	Wireless ECG signal transmitter	device that wirelessly transmits electrocardiogram (ECG) signals, measuring the electrical activity of the heart.	It measures the electrical activity of the heart and is crucial for monitoring cardiac health. The transmitter allows real-time or remote monitoring of a person's heart activity without the constraints of wired connections.	15
G01.1_111823101_2	mobile devices 	portable electronic tools  that enable communication, access to information, and various applications on the go.	Such as smartphones or tablets, are portable electronic tools that enable users to communicate, access information, and utilize applications while on the move.	15
G01.1_111823101_2	monitor units	devices used for observing, measuring, or recording specific parameters or activities.	Devices or systems employed to observe, measure, or record specific parameters, providing real-time information or data feedback.	15
G01.1_111823101_2	PDA	handheld electronic devices designed for personal organization.	Is a handheld electronic device designed for personal organization. PDAs often include features like calendars, note-taking, and contact management.	15
G01.1_111823101_2	personal digital assistant	handheld electronic devices designed for personal organization.	Is a handheld electronic device designed for personal organization. PDAs often include features like calendars, note-taking, and contact management.	15
G01.1_111823101_2	Web page	a document or information resource on the World Wide Web.	It typically contains a combination of text, images, and hyperlinks, providing content and interactivity for online users.	15
G01.1_111823101_2	wireless communication	transmission of data between devices without physical connections.	Involves the transmission of data or information between devices without the need for physical connections. It commonly utilizes technologies like Wi-Fi, Bluetooth, or cellular networks.	15
G01.1_111823101_3	monitor units	measurement unit used in radiation therapy and medical imaging.	In radiation therapy, monitor units represent a quantity used to calibrate the radiation dose delivered to a specific target area during treatment. In medical imaging, monitor units may be used to quantify the amount of radiation exposure or the intensity of a specific imaging procedure. Monitoring units are essential for ensuring accurate and controlled radiation delivery in therapeutic applications and for assessing radiation doses in diagnostic imaging.	15
G01.1_111823101_4	application	software program or tool designed to perform specific tasks or functions on electronic devices.	It can range from productivity tools and games to utilities and communication platforms on electronic devices such as computers, smartphones, or tablets.	15
G01.1_111823101_4	health care	organized provision of medical services to maintain or improve the health of individuals.	It involves the organized provision of medical services, treatments, and support aimed at maintaining or improving the health of individuals or communities. It encompasses a broad range of services, from preventive care to diagnosis, treatment, and rehabilitation.	15
G01.1_111823101_4	lifestyle	the way in which a person or group lives.	It refers to the way in which an individual or group lives, including their behaviors, habits, and choices. In the context of health, lifestyle considerations often include diet, exercise, sleep patterns, and other factors that contribute to overall well-being.	15
G01.1_111823101_4	medical personnel	professionals involved in healthcare.	This includes doctors, nurses, technicians, and other trained individuals responsible for delivering medical services, treatment, and care to patients.	15
G01.1_131359426_4	PDA	small, mobile, handheld device that provides computing and information storage and retrieval capabilities	acronym of personal digital assistant, the precursor to smartphones, which usually had a small physical keyboard even tough some had an electronically sensitive pad on which handwriting could be received	2
G01.1_131359426_4	personal digital assistant	small, mobile, handheld device that provides computing and information storage and retrieval capabilities	the precursor to smartphones, it usually had a small physical keyboard even tough some had an electronically sensitive pad on which handwriting could be received	2
G01.1_131359426_5	colour space	standardized way to describe colors	it provides a standardized way of defining and interpreting colors, allowing for consistency in color representation across various devices and applications	2
G01.1_131359426_7	PDA technology	application of scientific knowledge and engineering principles in order to develop the performance of a small, mobile, handheld device that provides computing and information storage and retrieval capabilities	scientific and engeneering studies that had as an objective the integration of new features to improve and develop the precursor to smartphones, which nowadays has become less common	2
G01.1_147704292_1	MDR-TB	MDR-TB is the acronym for Multidrug-resistant tuberculosis, a form of tuberculosis caused by bacteria resistant to at least two of the most potent anti-TB drugs. This resistance complicates treatment, requiring more extended and complex therapeutic regimens.	MDR-TB is the acronym for Multidrug-resistant tuberculosis is a variant of tuberculosis where the bacteria resist at least two of the most potent anti-TB drugs. This resistance poses challenges in treatment, necessitating more extended and complex therapeutic regimens. MDR-TB represents a critical concern in public health due to its increased difficulty in managing and higher associated healthcare burdens.	8
G01.1_147704292_1	MDR-TB	a form of tuberculosis caused by bacteria resistant to at least two of the most potent anti-TB drugs.	acronym for Multidrug-resistant tuberculosis, a variant of tuberculosis where the bacteria resist at least two of the most potent anti-TB drugs. This resistance poses challenges in treatment, necessitating more extended and complex therapeutic regimens. MDR-TB represents a critical concern in public health due to its increased difficulty in managing and higher associated healthcare burdens.	9
G01.1_147704292_1	multidrug-resistant tuberculosis	Multidrug-resistant tuberculosis is a form of tuberculosis caused by bacteria resistant to at least two of the most potent anti-TB drugs. This resistance complicates treatment, requiring more extended and complex therapeutic regimens.	Multidrug-resistant tuberculosis is a variant of tuberculosis where the bacteria resist at least two of the most potent anti-TB drugs. This resistance poses challenges in treatment, necessitating more extended and complex therapeutic regimens. MDR-TB represents a critical concern in public health due to its increased difficulty in managing and higher associated healthcare burdens.	8
G01.1_147704292_1	multidrug-resistant tuberculosis	a form of tuberculosis caused by bacteria resistant to at least two of the most potent anti-TB drugs.	a variant of tuberculosis where the bacteria resist at least two of the most potent anti-TB drugs. This resistance poses challenges in treatment, necessitating more extended and complex therapeutic regimens. Multidrug-resistant tuberculosis represents a critical concern in public health due to its increased difficulty in managing and higher associated healthcare burdens.	9
G01.1_147704292_1	NTP	NTP is the acronym for National Tuberculosis Program and it refers to the Peruvian National Tuberculosis Program, which is a government initiative focused on tuberculosis prevention, control, and treatment within Peru. This program aims to reduce TB incidence, improve patient outcomes, and address social determinants impacting TB transmission.	NTP is the acronym for National Tuberculosis Program and it refers to a government-driven initiative dedicated to preventing, controlling, and treating tuberculosis in Peru. Its goals include reducing TB incidence, enhancing patient outcomes, and addressing social determinants influencing TB transmission. PNTC plays a pivotal role in coordinating efforts, implementing strategies, and advancing public health responses to combat tuberculosis in the country.	8
G01.1_147704292_1	NTP	a government initiative focused on tuberculosis prevention, control, and treatment within Peru.	acronym for National Tuberculosis Program, which refers to a government-driven initiative dedicated to preventing, controlling, and treating tuberculosis in Peru. Its goals include reducing TB incidence, enhancing patient outcomes, and addressing social determinants influencing TB transmission. PNTC plays a pivotal role in coordinating efforts, implementing strategies, and advancing public health responses to combat tuberculosis in the country.	9
G01.1_147704292_1	partners in health	Partners In Health is a non-profit organization dedicated to providing comprehensive health care and addressing social determinants of health in resource-limited communities globally. Their mission focuses on achieving health equity and social justice.	Partners In Health is a non-profit organization committed to delivering comprehensive healthcare and addressing broader social determinants in resource-limited communities worldwide. With a mission centered on health equity and social justice, PIH works collaboratively to provide holistic and sustainable solutions, aiming to improve health outcomes and empower communities facing significant healthcare challenges.	8
G01.1_147704292_1	partners in health	a non-profit organization providing health care and addressing social determinants of health in resource-limited communities globally.	a non-profit organization committed to delivering comprehensive healthcare and addressing broader social determinants in resource-limited communities worldwide. With a mission centered on health equity and social justice, Partners In Health works collaboratively to provide sustainable solutions, aiming to improve health outcomes and empower communities facing significant healthcare challenges.	9
G01.1_147704292_1	peruvian national TB program	The Peruvian National Tuberculosis Program is a government initiative focused on tuberculosis prevention, control, and treatment within Peru. This program aims to reduce TB incidence, improve patient outcomes, and address social determinants impacting TB transmission.	The Peruvian National Tuberculosis Program is a government-driven initiative dedicated to preventing, controlling, and treating tuberculosis in Peru. Its goals include reducing TB incidence, enhancing patient outcomes, and addressing social determinants influencing TB transmission. PNTC plays a pivotal role in coordinating efforts, implementing strategies, and advancing public health responses to combat tuberculosis in the country.	8
G01.1_147704292_1	peruvian national TB program	a government initiative focused on tuberculosis prevention, control, and treatment within Peru.	a government-driven initiative dedicated to preventing, controlling, and treating tuberculosis in Peru. Its goals include reducing TB incidence, enhancing patient outcomes, and addressing social determinants influencing TB transmission. PNTC plays a pivotal role in coordinating efforts, implementing strategies, and advancing public health responses to combat tuberculosis in the country.	9
G01.1_147704292_1	PIH	PIH is the acronym of Partners In Health, a non-profit organization dedicated to providing comprehensive health care and addressing social determinants of health in resource-limited communities globally. Their mission focuses on achieving health equity and social justice.	PIH is the acronym of Partners In Health, a non-profit organization committed to delivering comprehensive healthcare and addressing broader social determinants in resource-limited communities worldwide. With a mission centered on health equity and social justice, PIH works collaboratively to provide holistic and sustainable solutions, aiming to improve health outcomes and empower communities facing significant healthcare challenges.	8
G01.1_147704292_1	PIH	a non-profit organization providing health care and addressing social determinants of health in resource-limited communities globally.	acronym for Partners In Health, a non-profit organization committed to delivering comprehensive healthcare and addressing broader social determinants in resource-limited communities worldwide. With a mission centered on health equity and social justice, PIH works collaboratively to provide sustainable solutions, aiming to improve health outcomes and empower communities facing significant healthcare challenges.	9
G01.1_147704292_1	SES	SES is the acronym of Socios En Salud, an affiliate of Partners In Health (PIH), a non-profit organization dedicated to providing healthcare services and addressing social determinants of health in resource-limited communities, particularly in Latin America. Their mission aligns with achieving health equity and social justice.	SES is the acronym of Socios En Salud, affiliated with Partners In Health (PIH),  a non-profit organization focused on delivering healthcare services and addressing social determinants of health, primarily in Latin America. Committed to health equity and social justice, they work collaboratively to provide comprehensive solutions and improve health outcomes in communities facing significant healthcare challenges.	8
G01.1_147704292_1	SES	a non-profit organization that provides healthcare services in resource-limited communities, particularly in Latin America.	acronym for Socios En Salud, a non-profit organization affiliated with Partners In Health (PIH),  focused on delivering healthcare services and addressing social determinants of health, primarily in Latin America. Committed to health equity and social justice, they work collaboratively to provide comprehensive solutions and improve health outcomes in communities facing significant healthcare challenges.	9
G01.1_147704292_1	socios en salud	Socios En Salud, an affiliate of Partners In Health (PIH), is a non-profit organization dedicated to providing healthcare services and addressing social determinants of health in resource-limited communities, particularly in Latin America. Their mission aligns with achieving health equity and social justice.	Socios En Salud, affiliated with Partners In Health (PIH), is a non-profit organization focused on delivering healthcare services and addressing social determinants of health, primarily in Latin America. Committed to health equity and social justice, they work collaboratively to provide comprehensive solutions and improve health outcomes in communities facing significant healthcare challenges.	8
G01.1_147704292_1	socios en salud	a non-profit organization that provides healthcare services in resource-limited communities, particularly in Latin America.	a non-profit organization affiliated with Partners In Health (PIH), focused on delivering healthcare services and addressing social determinants of health, primarily in Latin America. Committed to health equity and social justice, they work collaboratively to provide comprehensive solutions and improve health outcomes in communities facing significant healthcare challenges.	9
G01.1_147704292_2	bacteriology test	A bacteriology test is a laboratory examination that involves the identification and analysis of bacteria. This diagnostic procedure aids in determining the presence, type, and characteristics of bacteria in clinical samples, contributing to the diagnosis of infectious diseases.	A bacteriology test is a laboratory procedure that involves analyzing and identifying bacteria in clinical samples. This diagnostic tool is crucial for determining the presence, type, and characteristics of bacteria, aiding in the diagnosis of infectious diseases. Bacteriology tests play a key role in guiding appropriate treatment measures and understanding the microbial causes of various health conditions.	8
G01.1_147704292_2	bacteriology test	a laboratory examination that involves the identification and analysis of bacteria, contributing to the diagnosis of infectious diseases.	a laboratory procedure that involves analyzing and identifying bacteria in clinical samples. This diagnostic tool is crucial for determining the presence, type, and characteristics of bacteria, aiding in the diagnosis of infectious diseases. Bacteriology tests play a key role in guiding appropriate treatment measures and understanding the microbial causes of various health conditions.	9
G01.1_147704292_2	health establishment	A health establishment refers to any institution or facility dedicated to providing health services, including hospitals, clinics, or medical offices. These establishments aim to promote health, prevent illness, and deliver medical care to individuals and communities.	A health establishment is any institution or facility committed to offering health services, encompassing hospitals, clinics, or medical offices. Their primary objectives include promoting health, preventing illnesses, and delivering medical care to individuals and communities. These establishments serve as crucial components of healthcare systems, contributing to overall well-being and disease management.	8
G01.1_147704292_2	health establishment	any institution or facility dedicated to providing health services, including hospitals, clinics, or medical offices.	any institution or facility committed to offering health services, encompassing hospitals, clinics, or medical offices. Their primary objectives include promoting health, preventing illnesses, and delivering medical care to individuals and communities. These establishments serve as crucial components of healthcare systems, contributing to overall well-being and disease management.	9
G01.1_147704292_2	treatment	In the medical context, treatment refers to interventions and procedures aimed at managing or alleviating health conditions. It includes medications, therapies, surgeries, and lifestyle modifications designed to improve patient outcomes and enhance overall well-being.	In the medical field, treatment encompasses a range of interventions and procedures directed at managing or alleviating health conditions. This includes medications, therapies, surgeries, and lifestyle modifications, all tailored to improve patient outcomes and enhance overall well-being. Treatment strategies are diverse, depending on the nature and severity of the medical condition being addressed.	8
G01.1_147704292_2	treatment	interventions and procedures aimed at managing or alleviating health conditions, including medications, therapies, lifestyle modifications.	a range of interventions and procedures directed at managing or alleviating health conditions. This includes medications, therapies, surgeries, and lifestyle modifications, all tailored to improve patient outcomes and enhance overall well-being. Treatment strategies are diverse, depending on the nature and severity of the medical condition being addressed.	9
G01.1_147704292_3	bacteriology data	Bacteriology data refers to information obtained through the study of bacteria, including their identification, characteristics, and interactions. This data is crucial for understanding bacterial infections, developing treatments, and advancing knowledge in the field of microbiology.	Bacteriology data encompasses information derived from the study of bacteria, involving their identification, characteristics, and interactions. This data plays a critical role in comprehending bacterial infections, guiding the development of treatments, and advancing knowledge in microbiology. Bacteriology data aids researchers and healthcare professionals in addressing infectious diseases and promoting public health.	8
G01.1_147704292_3	bacteriology data	data obtained through the study of bacteria, including their identification, characteristics, and interactions.	data derived from the study of bacteria, involving their identification, characteristics, and interactions. This data plays a critical role in comprehending bacterial infections, guiding the development of treatments, and advancing knowledge in microbiology. Bacteriology data aids researchers and healthcare professionals in addressing infectious diseases and promoting public health.	9
