snt_id	term	definition	explanation	exp_id
M17_49_3	fibre	a fiber is a thread-like structure, typically composed of cells or proteins, contributing to the structure of tissues or organs. Fibers can vary in composition and function, forming essential components of various anatomical structures.	Biologically, a fiber refers to a thread-like structure, often comprising cells or proteins, that contributes to the composition of tissues or organs. These fibers vary in their composition and function, playing crucial roles in the structural integrity and functionality of diverse anatomical structures throughout the body.	8
M17_49_3	fibre	a thread-like structure, composed of cells or proteins, contributing to the structure of tissues or organs, it can vary in composition and function, forming essential components of various anatomical structures.	a thread-like structure, comprising cells or proteins, that contributes to the composition of tissues or organs. These fibers vary in their composition and function, playing crucial roles in the structural integrity and functionality of diverse anatomical structures throughout the body.	9
M17_49_3	hypertrophy	Hypertrophy is the process of cellular or organ enlargement, often observed in skeletal muscles due to increased workload, typically induced by resistance training. It involves the augmentation of individual muscle fibers, contributing to enhanced strength and size.	Hypertrophy, seen in skeletal muscles with intensified workload like resistance training, entails the enlargement of individual muscle fibers. This adaptive response involves increased protein synthesis and cell size, contributing to heightened muscle strength and size. It's a beneficial physiological adaptation to the demands placed on the muscles during specific activities like weightlifting.	8
M17_49_3	hypertrophy	the process of cellular or organ enlargement, typically induced by resistance training. It involves the augmentation of individual muscle fibers, enhancing strength and size.	seen in skeletal muscles with intensified workload like resistance training, it entails the enlargement of individual muscle fibers. This adaptive response involves increased protein synthesis and cell size, contributing to heightened muscle strength and size. It's a beneficial physiological adaptation to the demands placed on the muscles during specific activities like weightlifting.	9
M17_49_3	skeletal muscle	Skeletal muscle refers to the voluntary striated muscle tissue constituting the muscular system, attached to bones by tendons, enabling body movement through contraction and relaxation, under conscious control.	Skeletal muscle, the consciously controlled muscle tissue attached to bones, powers movement through contraction and relaxation. Striated in appearance, it works with tendons, connecting muscle to bone. This voluntary system forms the foundation of bodily motion and is distinct from involuntary muscles, like those in the heart or digestive tract.	8
M17_49_3	skeletal muscle	the voluntary striated muscle tissue attached to bones by tendons, enabling body movement through contraction and relaxation.	the consciously controlled muscle tissue attached to bones, powers movement through contraction and relaxation. Striated in appearance, it works with tendons, connecting muscle to bone. This voluntary system forms the foundation of bodily motion and is distinct from involuntary muscles, like those in the heart or digestive tract.	9
M17_49_4	biological model	A biological model is a simplified representation or simulation of a biological system, used to study and understand complex biological processes. These models help researchers make predictions and gain insights into real-world phenomena.	A biological model is a simplified representation or simulation of a biological system, providing a tool for studying intricate processes. Researchers employ these models to gain insights, make predictions, and understand complex biological phenomena in a more manageable and controlled environment. This aids in advancing our comprehension of real-world biological systems and their underlying mechanisms.	8
M17_49_4	biological model	a simplified representation or simulation of a biological system, used to study and understand complex biological processes.	a simplified representation or simulation of a biological system, providing a tool for studying intricate processes. Researchers employ these models to gain insights, make predictions, and understand complex biological phenomena in a more manageable and controlled environment. This aids in advancing our comprehension of real-world biological systems and their underlying mechanisms.	9
M17_49_4	cell	A cell is the basic structural and functional unit of living organisms, capable of independent life processes. Cells can vary in size, shape, and function, and they constitute the building blocks of tissues and organs.	A cell is the fundamental unit of life, possessing both structural and functional autonomy. Varied in size, shape, and function, cells serve as the basic building blocks of tissues and organs within living organisms. Their ability to perform independent life processes underpins the complexity and functionality of biological systems.	8
M17_49_4	cell	the basic structural and functional unit of living organisms, capable of independent life processes, it can vary in size, shape, and function.	the fundamental unit of life, possessing both structural and functional autonomy. Varied in size, shape, and function, cells serve as the basic building blocks of tissues and organs within living organisms. Their ability to perform independent life processes underpins the complexity and functionality of biological systems.	9
M17_49_4	myonucleus	A myonucleus is a cell nucleus found within a muscle fiber. These nuclei play a crucial role in governing protein synthesis, growth, and repair processes, contributing to the adaptive responses observed in skeletal muscles.	A myonucleus is a cell nucleus located within a muscle fiber, essential for key processes like protein synthesis, growth, and repair. Particularly significant in skeletal muscles, myonuclei contribute to the adaptive responses of muscles to stimuli like resistance training, influencing overall muscle function, size, and the capacity for recovery and repair.	8
M17_49_4	myonucleus	a cell nucleus found within a muscle fiber, it plays a crucial role in governing protein synthesis, growth, and repair processes.	a cell nucleus located within a muscle fiber, essential for key processes like protein synthesis, growth, and repair. Particularly significant in skeletal muscles, myonuclei contribute to the adaptive responses of muscles to stimuli like resistance training, influencing overall muscle function, size, and the capacity for recovery and repair.	9
M17_49_5	hypertrophic growth	Hypertrophic growth refers to the increase in size and mass of individual cells, particularly observed in skeletal muscles. It results from enhanced protein synthesis and cell enlargement, commonly triggered by resistance training, contributing to greater muscle fiber dimensions.	Hypertrophic growth specifically pertains to the enlargement of individual cells, notably in skeletal muscles. This process involves heightened protein synthesis, leading to increased cell size. Often induced by resistance training, hypertrophic growth results in the augmentation of muscle fiber dimensions, enhancing overall muscle mass and strength in response to the applied mechanical stress.	8
M17_49_5	hypertrophic growth	the increase in size and mass of individual cells, particularly observed in skeletal muscles, it results from enhanced protein synthesis and cell enlargement.	it specifically pertains to the enlargement of individual cells, notably in skeletal muscles. This process involves heightened protein synthesis, leading to increased cell size. Often induced by resistance training, hypertrophic growth results in the augmentation of muscle fiber dimensions, enhancing overall muscle mass and strength in response to the applied mechanical stress.	9
M17_49_5	satellite cell	A satellite cell is a type of undifferentiated cell found in skeletal muscles. Activated in response to muscle damage or growth stimuli, these cells play a crucial role in muscle repair, regeneration, and hypertrophy.	Satellite cells, situated in skeletal muscles, are undifferentiated cells activated in response to muscle damage or growth signals. Integral to muscle repair and regeneration, these cells contribute to hypertrophy by differentiating into mature muscle cells. Their responsiveness to stimuli underscores their pivotal role in maintaining muscle integrity and facilitating adaptive responses to increased demand or injury.	8
M17_49_5	satellite cell	a type of undifferentiated cell found in skeletal muscles activated in response to muscle damage or growth stimuli, playing a crucial role in muscle repair, regeneration, and hypertrophy.	situated in skeletal muscles, undifferentiated cells activated in response to muscle damage or growth signals. Integral to muscle repair and regeneration, these cells contribute to hypertrophy by differentiating into mature muscle cells. Their responsiveness to stimuli underscores their pivotal role in maintaining muscle integrity and facilitating adaptive responses to increased demand or injury.	9
M17_49_6	apoptotic activity	Apoptotic activity refers to the process of programmed cell death, known as apoptosis. It involves the orderly and controlled dismantling of cells, crucial for maintaining tissue homeostasis, eliminating damaged cells, and regulating development.	Apoptotic activity encompasses the orchestrated mechanism of programmed cell death, scientifically termed apoptosis. This regulated process involves the systematic breakdown of cells, playing a vital role in maintaining tissue balance, eliminating damaged or unnecessary cells, and contributing to the precision of developmental processes. Apoptotic activity is crucial for overall cellular health and the body's normal physiological functions.	8
M17_49_6	apoptotic activity	the process of programmed cell death involving the orderly and controlled dismantling of cells, maintaining tissue homeostasis, eliminating damaged cells, and regulating development.	the orchestrated mechanism of programmed cell death. This regulated process involves the systematic breakdown of cells, playing a vital role in maintaining tissue balance, eliminating damaged or unnecessary cells, and contributing to the precision of developmental processes. Apoptotic activity is crucial for overall cellular health and the body's normal physiological functions.	9
M17_49_6	grave atrophy	Grave atrophy refers to the severe and extensive wasting or degeneration of tissues, often used in the context of muscle or organ deterioration. This condition signifies a significant loss of structural integrity and functional capacity.	Grave atrophy describes the extreme and extensive deterioration of tissues, commonly observed in muscles or organs. This condition indicates a substantial loss of both structural integrity and functional capacity. Grave atrophy may result from various factors such as prolonged disuse, neurodegenerative diseases, or other pathological processes, leading to profound tissue wasting.	8
M17_49_6	grave atrophy	the severe and extensive wasting or degeneration of tissues leading to muscle or organ deterioration, thus to a significant loss of structural integrity and functional capacity.	it describes the extreme and extensive deterioration of tissues, commonly observed in muscles or organs. This condition indicates a substantial loss of both structural integrity and functional capacity. Grave atrophy may result from various factors such as prolonged disuse, neurodegenerative diseases, or other pathological processes, leading to profound tissue wasting.	9
M17_49_7	nucleus	In biological terms, a nucleus is a membrane-bound organelle within cells, containing genetic material (DNA). It serves as the control center, directing cellular activities and orchestrating processes such as DNA replication and gene expression.	A nucleus, a membrane-bound organelle in cells, houses genetic material (DNA) and acts as the cellular control center. It plays a central role in directing cellular activities by regulating processes like DNA replication and gene expression. The nucleus is vital for maintaining the integrity of genetic information and coordinating essential functions within the cell.	8
M17_49_7	nucleus	a membrane-bound organelle within cells, containing genetic material (DNA) and serving as the control center.	a membrane-bound organelle in cells, it houses genetic material (DNA) and acts as the cellular control center. It plays a central role in directing cellular activities by regulating processes like DNA replication and gene expression. The nucleus is vital for maintaining the integrity of genetic information and coordinating essential functions within the cell.	9
M17_49_7	overload exercise	Overload exercise refers to a training principle involving the application of a stimulus beyond the normal physiological capacity, challenging the body to adapt and improve. It plays a key role in eliciting physiological responses, such as muscle hypertrophy and strength gains.	Overload exercise is a training principle that involves subjecting the body to a stimulus exceeding its regular physiological load. This intentional challenge encourages the body to adapt and enhance its capabilities. Overload exercises are pivotal in inducing physiological responses, including muscle hypertrophy and strength gains, by pushing the body beyond its accustomed limits during physical training.	8
M17_49_7	overload exercise	a training principle involving the application of a stimulus beyond the normal physiological capacity, challenging the body to adapt and improve.	a training principle that involves subjecting the body to a stimulus exceeding its regular physiological load. This intentional challenge encourages the body to adapt and enhance its capabilities. Overload exercises are pivotal in inducing physiological responses, including muscle hypertrophy and strength gains, by pushing the body beyond its accustomed limits during physical training.	9
M17_49_9	muscle memory	Muscle memory refers to the phenomenon where muscles retain a memory of repetitive movements, facilitating enhanced performance and motor skill acquisition. This adaptive process involves the nervous system and is crucial in activities requiring precision and coordination.	Muscle memory is the retention of motor patterns in muscles, enabling improved performance through repeated actions. This adaptive process involves the nervous system, enhancing precision and coordination in activities. Whether in sports, music, or other skills, muscle memory reflects the capacity of muscles and the brain to collaborate and optimize repeated movements.	8
M17_49_9	muscle memory	the phenomenon where muscles retain a memory of repetitive movements, facilitating enhanced performance and motor skill acquisition.	the retention of motor patterns in muscles, enabling improved performance through repeated actions. This adaptive process involves the nervous system, enhancing precision and coordination in activities. Whether in sports, music, or other skills, muscle memory reflects the capacity of muscles and the brain to collaborate and optimize repeated movements.	9
M17_49_9	strength training	Strength training is a form of exercise focusing on resistance to build and develop muscular strength. This involves lifting weights, using resistance bands, or performing bodyweight exercises, aiming to induce muscle hypertrophy, enhance endurance, and improve overall strength.	Strength training is an exercise regimen concentrating on resistance to enhance muscular strength. It encompasses activities like weightlifting, resistance band exercises, or bodyweight workouts. The goal is to induce muscle hypertrophy, boost endurance, and enhance overall strength. Consistent strength training contributes to improved physical performance, body composition, and functional capacity.	8
M17_49_9	strength training	exercises that utilize external resistance to induce muscle contraction, promoting strength, endurance, and hypertrophy.	refers to excercises that employ external resistance to stimulate muscle contractions, fostering gains in strength, endurance, and muscle size (hypertrophy). Activities like weightlifting, using resistance bands, or bodyweight exercises constitute this form of training, contributing not only to muscle development but also overall physical fitness and functional capacity.	9
M18_50_2	Adiposity	"Adiposity refers to body fat and is derived from ""adipo,"" referring to fat."	It refers to the fat tissue present in the body	16
M18_50_2	Observational studies	Observational studies are research studies in which researchers collect information from participants or look at data that was already collected. 	It refers to researches which are focused on data-collecting and analysing	16
M18_50_3	Lean mass	Body mass can be divided into two major components: body fat (energy stores) and lean mass (including muscle, organs, and bones	It refers to the part of body mass which isn’t composed of fat tissue, but by other components	16
M18_50_3	Meta analysis	Meta-analysis is a quantitative, formal, epidemiological study design used to systematically assess the results of previous research to derive conclusions about that body of research. Typically, but not necessarily, the study is based on randomized, controlled clinical trials	It refers to studies focusing on verifying the results of past researches on the same topic, sometimes employing randomized trials	16
M18_50_3	Narrative review	Narrative review is an umbrella term for a collection of review types in which the review process goes beyond an opinion or commentary. In a narrative review, researchers can pursue an extensive description and interpretation of previously published writing on a chosen topic	It refers to different review types which include more than commentary/opinions, thanks to an in-depth analysis by its researchers	16
M18_50_4	Body fat percentage	The BFP of a person or other organism is the total mass of fat divided by the total body mass, multiplied by 100	It refers to the percentage of body fat present in a body	16
M18_50_4	Feeding frequency	number of times of feeding in a day	It refers to the number of feedings made by human or animal in a specific time window	16
M18_50_5	Body composition	Body composition is a universal term used in the health and fitness industry. Doctors use body composition to find what percentage of the body weight is fat	It refers to the percentage of fat tissue in the person’s body, applied in medicine and fitness	16
M18_50_5	Feeding frequency	number of times of feeding in a day	It refers to the number of feedings made by human or animal in a specific time window	16
M18_50_5	Meta analysis	Meta-analysis is a quantitative, formal, epidemiological study design used to systematically assess the results of previous research to derive conclusions about that body of research. Typically, but not necessarily, the study is based on randomized, controlled clinical trials	It refers to studies focusing on verifying the results of past researches on the same topic, sometimes employing randomized trials	16
M18_50_5	Sensitivity analysis	Sensitivity analysis determines the effectiveness of antibiotics against microorganisms (germs) such as bacteria that have been isolated from cultures.	It refers to the results of antibiotics applied to isolated microorganisms which have been cultivated	16
M20_52_1	human aging	Human aging refers to the multifaceted biological process encompassing time-dependent structural and functional changes at the cellular and molecular levels, resulting in a gradual decline of physiological integrity, resilience, and homeostasis.	Human aging involves the intricate biological progression where over time, there are various changes at the microscopic and molecular levels in our bodies. These alterations lead to a gradual decline in overall health, resilience, and the ability to maintain internal balance, known as homeostasis.	8
M20_52_1	human aging	the multifaceted biological process encompassing time-dependent structural and functional changes at the cellular and molecular levels in the human body.	it involves the intricate biological progression where over time, there are various changes at the microscopic and molecular levels in human bodies. These alterations lead to a gradual decline in overall health, resilience, and the ability to maintain internal balance, known as homeostasis.	9
M20_52_1	skeletal muscle	Skeletal muscle refers to the voluntary striated muscle tissue constituting the muscular system, attached to bones by tendons, enabling body movement through contraction and relaxation, under conscious control.	Skeletal muscle, the consciously controlled muscle tissue attached to bones, powers movement through contraction and relaxation. Striated in appearance, it works with tendons, connecting muscle to bone. This voluntary system forms the foundation of bodily motion and is distinct from involuntary muscles, like those in the heart or digestive tract.	8
M20_52_1	skeletal muscle	the voluntary striated muscle tissue attached to bones by tendons, enabling body movement through contraction and relaxation.	the consciously controlled muscle tissue attached to bones, powers movement through contraction and relaxation. Striated in appearance, it works with tendons, connecting muscle to bone. This voluntary system forms the foundation of bodily motion and is distinct from involuntary muscles, like those in the heart or digestive tract.	9
M20_52_2	muscle mass	Muscle mass refers to the total weight of skeletal muscles in the body, encompassing both lean and fat components. It signifies the overall quantity of muscle tissue and plays a crucial role in physical performance and metabolic health.	Muscle mass represents the combined weight of skeletal muscles, incorporating both lean and fat elements. This metric is pivotal in assessing the quantity of muscle tissue, influencing physical performance and metabolic health. Adequate muscle mass contributes to strength, mobility, and overall well-being, while its decline may impact functionality and metabolism.	8
M20_52_2	muscle mass	the total weight of skeletal muscles in the body, encompassing both lean and fat components.	it represents the combined weight of skeletal muscles, incorporating both lean and fat elements. This metric is pivotal in assessing the quantity of muscle tissue, influencing physical performance and metabolic health. Adequate muscle mass contributes to strength, mobility, and overall well-being, while its decline may impact functionality and metabolism.	9
M20_52_2	musculoskeletal impairment	Musculoskeletal impairment refers to conditions affecting the body's musculoskeletal system, involving bones, muscles, joints, ligaments, and tendons. These disorders lead to functional limitations, pain, and reduced mobility, impacting daily activities and overall well-being.	Musculoskeletal impairment encompasses disorders affecting the body's framework—bones, muscles, joints, ligaments, and tendons. These conditions result in functional limitations, pain, and decreased mobility, adversely affecting day-to-day activities and overall quality of life. Common examples include arthritis and injuries, highlighting the broad range of issues within the musculoskeletal system.	8
M20_52_2	musculoskeletal impairment	refers to conditions affecting the body's musculoskeletal system, leading to functional limitations, pain, and reduced mobility.	it encompasses disorders affecting the body's framework—bones, muscles, joints, ligaments, and tendons. These conditions result in functional limitations, pain, and decreased mobility, adversely affecting day-to-day activities and overall quality of life. Common examples include arthritis and injuries, highlighting the broad range of issues within the musculoskeletal system.	9
M20_52_2	sarcopenia	Sarcopenia denotes the age-related decline in skeletal muscle mass, strength, and function, characterized by the progressive loss of muscle tissue and diminished muscle quality, impacting physical performance and increasing frailty.	Sarcopenia is the age-associated reduction in muscle mass, strength, and function. This condition involves the gradual deterioration of muscle tissue, leading to decreased physical performance and increased frailty. As a consequence, individuals with sarcopenia may experience challenges in daily activities due to the weakening and loss of muscle quality.	8
M20_52_2	sarcopenia	the age-related decline in skeletal muscle mass, strength, and function, impacting physical performance and increasing frailty.	the age-associated reduction in muscle mass, strength, and function. This condition involves the gradual deterioration of muscle tissue, leading to decreased physical performance and increased frailty. As a consequence, individuals with sarcopenia may experience challenges in daily activities due to the weakening and loss of muscle quality.	9
